{
  "pack": "suwar",
  "version": "1.1.2",
  "edition": "alquran-cloud:quran-uthmani",
  "basmala": "بِسْمِ ٱللَّهِ ٱلرَّحْمَٰنِ ٱلرَّحِيمِ",
  "suwar": [
    {
      "id": "kahf",
      "surah": "سورة الكهف",
      "surahNumber": 18,
      "pages": [
        {
          "id": "kahf-1-4",
          "range": "الآيات ١ – ٤",
          "ayahs": [
            {
              "number": 1,
              "text": "ٱلْحَمْدُ لِلَّهِ ٱلَّذِىٓ أَنزَلَ عَلَىٰ عَبْدِهِ ٱلْكِتَٰبَ وَلَمْ يَجْعَل لَّهُۥ عِوَجَا ۜ"
            },
            {
              "number": 2,
              "text": "قَيِّمًۭا لِّيُنذِرَ بَأْسًۭا شَدِيدًۭا مِّن لَّدُنْهُ وَيُبَشِّرَ ٱلْمُؤْمِنِينَ ٱلَّذِينَ يَعْمَلُونَ ٱلصَّٰلِحَٰتِ أَنَّ لَهُمْ أَجْرًا حَسَنًۭا"
            },
            {
              "number": 3,
              "text": "مَّٰكِثِينَ فِيهِ أَبَدًۭا"
            },
            {
              "number": 4,
              "text": "وَيُنذِرَ ٱلَّذِينَ قَالُوا۟ ٱتَّخَذَ ٱللَّهُ وَلَدًۭا"
            }
          ]
        },
        {
          "id": "kahf-5-8",
          "range": "الآيات ٥ – ٨",
          "ayahs": [
            {
              "number": 5,
              "text": "مَّا لَهُم بِهِۦ مِنْ عِلْمٍۢ وَلَا لِـَٔابَآئِهِمْ ۚ كَبُرَتْ كَلِمَةًۭ تَخْرُجُ مِنْ أَفْوَٰهِهِمْ ۚ إِن يَقُولُونَ إِلَّا كَذِبًۭا"
            },
            {
              "number": 6,
              "text": "فَلَعَلَّكَ بَٰخِعٌۭ نَّفْسَكَ عَلَىٰٓ ءَاثَٰرِهِمْ إِن لَّمْ يُؤْمِنُوا۟ بِهَٰذَا ٱلْحَدِيثِ أَسَفًا"
            },
            {
              "number": 7,
              "text": "إِنَّا جَعَلْنَا مَا عَلَى ٱلْأَرْضِ زِينَةًۭ لَّهَا لِنَبْلُوَهُمْ أَيُّهُمْ أَحْسَنُ عَمَلًۭا"
            },
            {
              "number": 8,
              "text": "وَإِنَّا لَجَٰعِلُونَ مَا عَلَيْهَا صَعِيدًۭا جُرُزًا"
            }
          ]
        },
        {
          "id": "kahf-9-12",
          "range": "الآيات ٩ – ١٢",
          "ayahs": [
            {
              "number": 9,
              "text": "أَمْ حَسِبْتَ أَنَّ أَصْحَٰبَ ٱلْكَهْفِ وَٱلرَّقِيمِ كَانُوا۟ مِنْ ءَايَٰتِنَا عَجَبًا"
            },
            {
              "number": 10,
              "text": "إِذْ أَوَى ٱلْفِتْيَةُ إِلَى ٱلْكَهْفِ فَقَالُوا۟ رَبَّنَآ ءَاتِنَا مِن لَّدُنكَ رَحْمَةًۭ وَهَيِّئْ لَنَا مِنْ أَمْرِنَا رَشَدًۭا"
            },
            {
              "number": 11,
              "text": "فَضَرَبْنَا عَلَىٰٓ ءَاذَانِهِمْ فِى ٱلْكَهْفِ سِنِينَ عَدَدًۭا"
            },
            {
              "number": 12,
              "text": "ثُمَّ بَعَثْنَٰهُمْ لِنَعْلَمَ أَىُّ ٱلْحِزْبَيْنِ أَحْصَىٰ لِمَا لَبِثُوٓا۟ أَمَدًۭا"
            }
          ]
        },
        {
          "id": "kahf-13-15",
          "range": "الآيات ١٣ – ١٥",
          "ayahs": [
            {
              "number": 13,
              "text": "نَّحْنُ نَقُصُّ عَلَيْكَ نَبَأَهُم بِٱلْحَقِّ ۚ إِنَّهُمْ فِتْيَةٌ ءَامَنُوا۟ بِرَبِّهِمْ وَزِدْنَٰهُمْ هُدًۭى"
            },
            {
              "number": 14,
              "text": "وَرَبَطْنَا عَلَىٰ قُلُوبِهِمْ إِذْ قَامُوا۟ فَقَالُوا۟ رَبُّنَا رَبُّ ٱلسَّمَٰوَٰتِ وَٱلْأَرْضِ لَن نَّدْعُوَا۟ مِن دُونِهِۦٓ إِلَٰهًۭا ۖ لَّقَدْ قُلْنَآ إِذًۭا شَطَطًا"
            },
            {
              "number": 15,
              "text": "هَٰٓؤُلَآءِ قَوْمُنَا ٱتَّخَذُوا۟ مِن دُونِهِۦٓ ءَالِهَةًۭ ۖ لَّوْلَا يَأْتُونَ عَلَيْهِم بِسُلْطَٰنٍۭ بَيِّنٍۢ ۖ فَمَنْ أَظْلَمُ مِمَّنِ ٱفْتَرَىٰ عَلَى ٱللَّهِ كَذِبًۭا"
            }
          ]
        },
        {
          "id": "kahf-16-17",
          "range": "الآيات ١٦ – ١٧",
          "ayahs": [
            {
              "number": 16,
              "text": "وَإِذِ ٱعْتَزَلْتُمُوهُمْ وَمَا يَعْبُدُونَ إِلَّا ٱللَّهَ فَأْوُۥٓا۟ إِلَى ٱلْكَهْفِ يَنشُرْ لَكُمْ رَبُّكُم مِّن رَّحْمَتِهِۦ وَيُهَيِّئْ لَكُم مِّنْ أَمْرِكُم مِّرْفَقًۭا"
            },
            {
              "number": 17,
              "text": "۞ وَتَرَى ٱلشَّمْسَ إِذَا طَلَعَت تَّزَٰوَرُ عَن كَهْفِهِمْ ذَاتَ ٱلْيَمِينِ وَإِذَا غَرَبَت تَّقْرِضُهُمْ ذَاتَ ٱلشِّمَالِ وَهُمْ فِى فَجْوَةٍۢ مِّنْهُ ۚ ذَٰلِكَ مِنْ ءَايَٰتِ ٱللَّهِ ۗ مَن يَهْدِ ٱللَّهُ فَهُوَ ٱلْمُهْتَدِ ۖ وَمَن يُضْلِلْ فَلَن تَجِدَ لَهُۥ وَلِيًّۭا مُّرْشِدًۭا"
            }
          ]
        },
        {
          "id": "kahf-18-18",
          "range": "الآية ١٨",
          "ayahs": [
            {
              "number": 18,
              "text": "وَتَحْسَبُهُمْ أَيْقَاظًۭا وَهُمْ رُقُودٌۭ ۚ وَنُقَلِّبُهُمْ ذَاتَ ٱلْيَمِينِ وَذَاتَ ٱلشِّمَالِ ۖ وَكَلْبُهُم بَٰسِطٌۭ ذِرَاعَيْهِ بِٱلْوَصِيدِ ۚ لَوِ ٱطَّلَعْتَ عَلَيْهِمْ لَوَلَّيْتَ مِنْهُمْ فِرَارًۭا وَلَمُلِئْتَ مِنْهُمْ رُعْبًۭا"
            }
          ]
        },
        {
          "id": "kahf-19-19",
          "range": "الآية ١٩",
          "ayahs": [
            {
              "number": 19,
              "text": "وَكَذَٰلِكَ بَعَثْنَٰهُمْ لِيَتَسَآءَلُوا۟ بَيْنَهُمْ ۚ قَالَ قَآئِلٌۭ مِّنْهُمْ كَمْ لَبِثْتُمْ ۖ قَالُوا۟ لَبِثْنَا يَوْمًا أَوْ بَعْضَ يَوْمٍۢ ۚ قَالُوا۟ رَبُّكُمْ أَعْلَمُ بِمَا لَبِثْتُمْ فَٱبْعَثُوٓا۟ أَحَدَكُم بِوَرِقِكُمْ هَٰذِهِۦٓ إِلَى ٱلْمَدِينَةِ فَلْيَنظُرْ أَيُّهَآ أَزْكَىٰ طَعَامًۭا فَلْيَأْتِكُم بِرِزْقٍۢ مِّنْهُ وَلْيَتَلَطَّفْ وَلَا يُشْعِرَنَّ بِكُمْ أَحَدًا"
            }
          ]
        },
        {
          "id": "kahf-20-21",
          "range": "الآيات ٢٠ – ٢١",
          "ayahs": [
            {
              "number": 20,
              "text": "إِنَّهُمْ إِن يَظْهَرُوا۟ عَلَيْكُمْ يَرْجُمُوكُمْ أَوْ يُعِيدُوكُمْ فِى مِلَّتِهِمْ وَلَن تُفْلِحُوٓا۟ إِذًا أَبَدًۭا"
            },
            {
              "number": 21,
              "text": "وَكَذَٰلِكَ أَعْثَرْنَا عَلَيْهِمْ لِيَعْلَمُوٓا۟ أَنَّ وَعْدَ ٱللَّهِ حَقٌّۭ وَأَنَّ ٱلسَّاعَةَ لَا رَيْبَ فِيهَآ إِذْ يَتَنَٰزَعُونَ بَيْنَهُمْ أَمْرَهُمْ ۖ فَقَالُوا۟ ٱبْنُوا۟ عَلَيْهِم بُنْيَٰنًۭا ۖ رَّبُّهُمْ أَعْلَمُ بِهِمْ ۚ قَالَ ٱلَّذِينَ غَلَبُوا۟ عَلَىٰٓ أَمْرِهِمْ لَنَتَّخِذَنَّ عَلَيْهِم مَّسْجِدًۭا"
            }
          ]
        },
        {
          "id": "kahf-22-23",
          "range": "الآيات ٢٢ – ٢٣",
          "ayahs": [
            {
              "number": 22,
              "text": "سَيَقُولُونَ ثَلَٰثَةٌۭ رَّابِعُهُمْ كَلْبُهُمْ وَيَقُولُونَ خَمْسَةٌۭ سَادِسُهُمْ كَلْبُهُمْ رَجْمًۢا بِٱلْغَيْبِ ۖ وَيَقُولُونَ سَبْعَةٌۭ وَثَامِنُهُمْ كَلْبُهُمْ ۚ قُل رَّبِّىٓ أَعْلَمُ بِعِدَّتِهِم مَّا يَعْلَمُهُمْ إِلَّا قَلِيلٌۭ ۗ فَلَا تُمَارِ فِيهِمْ إِلَّا مِرَآءًۭ ظَٰهِرًۭا وَلَا تَسْتَفْتِ فِيهِم مِّنْهُمْ أَحَدًۭا"
            },
            {
              "number": 23,
              "text": "وَلَا تَقُولَنَّ لِشَا۟ىْءٍ إِنِّى فَاعِلٌۭ ذَٰلِكَ غَدًا"
            }
          ]
        },
        {
          "id": "kahf-24-26",
          "range": "الآيات ٢٤ – ٢٦",
          "ayahs": [
            {
              "number": 24,
              "text": "إِلَّآ أَن يَشَآءَ ٱللَّهُ ۚ وَٱذْكُر رَّبَّكَ إِذَا نَسِيتَ وَقُلْ عَسَىٰٓ أَن يَهْدِيَنِ رَبِّى لِأَقْرَبَ مِنْ هَٰذَا رَشَدًۭا"
            },
            {
              "number": 25,
              "text": "وَلَبِثُوا۟ فِى كَهْفِهِمْ ثَلَٰثَ مِا۟ئَةٍۢ سِنِينَ وَٱزْدَادُوا۟ تِسْعًۭا"
            },
            {
              "number": 26,
              "text": "قُلِ ٱللَّهُ أَعْلَمُ بِمَا لَبِثُوا۟ ۖ لَهُۥ غَيْبُ ٱلسَّمَٰوَٰتِ وَٱلْأَرْضِ ۖ أَبْصِرْ بِهِۦ وَأَسْمِعْ ۚ مَا لَهُم مِّن دُونِهِۦ مِن وَلِىٍّۢ وَلَا يُشْرِكُ فِى حُكْمِهِۦٓ أَحَدًۭا"
            }
          ]
        },
        {
          "id": "kahf-27-28",
          "range": "الآيات ٢٧ – ٢٨",
          "ayahs": [
            {
              "number": 27,
              "text": "وَٱتْلُ مَآ أُوحِىَ إِلَيْكَ مِن كِتَابِ رَبِّكَ ۖ لَا مُبَدِّلَ لِكَلِمَٰتِهِۦ وَلَن تَجِدَ مِن دُونِهِۦ مُلْتَحَدًۭا"
            },
            {
              "number": 28,
              "text": "وَٱصْبِرْ نَفْسَكَ مَعَ ٱلَّذِينَ يَدْعُونَ رَبَّهُم بِٱلْغَدَوٰةِ وَٱلْعَشِىِّ يُرِيدُونَ وَجْهَهُۥ ۖ وَلَا تَعْدُ عَيْنَاكَ عَنْهُمْ تُرِيدُ زِينَةَ ٱلْحَيَوٰةِ ٱلدُّنْيَا ۖ وَلَا تُطِعْ مَنْ أَغْفَلْنَا قَلْبَهُۥ عَن ذِكْرِنَا وَٱتَّبَعَ هَوَىٰهُ وَكَانَ أَمْرُهُۥ فُرُطًۭا"
            }
          ]
        },
        {
          "id": "kahf-29-30",
          "range": "الآيات ٢٩ – ٣٠",
          "ayahs": [
            {
              "number": 29,
              "text": "وَقُلِ ٱلْحَقُّ مِن رَّبِّكُمْ ۖ فَمَن شَآءَ فَلْيُؤْمِن وَمَن شَآءَ فَلْيَكْفُرْ ۚ إِنَّآ أَعْتَدْنَا لِلظَّٰلِمِينَ نَارًا أَحَاطَ بِهِمْ سُرَادِقُهَا ۚ وَإِن يَسْتَغِيثُوا۟ يُغَاثُوا۟ بِمَآءٍۢ كَٱلْمُهْلِ يَشْوِى ٱلْوُجُوهَ ۚ بِئْسَ ٱلشَّرَابُ وَسَآءَتْ مُرْتَفَقًا"
            },
            {
              "number": 30,
              "text": "إِنَّ ٱلَّذِينَ ءَامَنُوا۟ وَعَمِلُوا۟ ٱلصَّٰلِحَٰتِ إِنَّا لَا نُضِيعُ أَجْرَ مَنْ أَحْسَنَ عَمَلًا"
            }
          ]
        },
        {
          "id": "kahf-31-32",
          "range": "الآيات ٣١ – ٣٢",
          "ayahs": [
            {
              "number": 31,
              "text": "أُو۟لَٰٓئِكَ لَهُمْ جَنَّٰتُ عَدْنٍۢ تَجْرِى مِن تَحْتِهِمُ ٱلْأَنْهَٰرُ يُحَلَّوْنَ فِيهَا مِنْ أَسَاوِرَ مِن ذَهَبٍۢ وَيَلْبَسُونَ ثِيَابًا خُضْرًۭا مِّن سُندُسٍۢ وَإِسْتَبْرَقٍۢ مُّتَّكِـِٔينَ فِيهَا عَلَى ٱلْأَرَآئِكِ ۚ نِعْمَ ٱلثَّوَابُ وَحَسُنَتْ مُرْتَفَقًۭا"
            },
            {
              "number": 32,
              "text": "۞ وَٱضْرِبْ لَهُم مَّثَلًۭا رَّجُلَيْنِ جَعَلْنَا لِأَحَدِهِمَا جَنَّتَيْنِ مِنْ أَعْنَٰبٍۢ وَحَفَفْنَٰهُمَا بِنَخْلٍۢ وَجَعَلْنَا بَيْنَهُمَا زَرْعًۭا"
            }
          ]
        },
        {
          "id": "kahf-33-36",
          "range": "الآيات ٣٣ – ٣٦",
          "ayahs": [
            {
              "number": 33,
              "text": "كِلْتَا ٱلْجَنَّتَيْنِ ءَاتَتْ أُكُلَهَا وَلَمْ تَظْلِم مِّنْهُ شَيْـًۭٔا ۚ وَفَجَّرْنَا خِلَٰلَهُمَا نَهَرًۭا"
            },
            {
              "number": 34,
              "text": "وَكَانَ لَهُۥ ثَمَرٌۭ فَقَالَ لِصَٰحِبِهِۦ وَهُوَ يُحَاوِرُهُۥٓ أَنَا۠ أَكْثَرُ مِنكَ مَالًۭا وَأَعَزُّ نَفَرًۭا"
            },
            {
              "number": 35,